{
    "[標的] 2888 積少成多": {
        "STOCK_ID": "2888",
        "TITLE": "[標的] 2888 積少成多",
        "ID": "M.1728477929.A.3FB",
        "LINK": "https://www.ptt.cc/bbs/Stock/M.1728477929.A.3FB.html",
        "AUTHOR": "mico861405",
        "CONTENT": "作者mico861405 (果子)看板Stock標題[標的] 2888 積少成多時間Wed Oct  9 20:45:27 2024\n各位好我肥宅啦\n原本我只是空手看戲的鄉民\n但不得不說\n今天兩方股東投票同意合併\n長線股價潛力實在太香\n建倉成本也很低\n\n雖說還有金管會這關要過\n但狗狗過去也是股利好，可長期投資\n消金、保險都沒有出過什麼巨大爭議\n\n現在兩家要合併\n讓更大的規模有望會有更好的經營績效\n金管會也沒什麼理由不放行\n\n金管會鼓勵合意併購應該玩真的\n否決中信也給了很明確的理由\n確立遊戲規則\n也讓往後的整併能有前例可循\n\n總之我要進場當瓜農了\n今天還下跌了一點，現在進場正好\n\n--\n※ 發信站: 批踢踢實業坊(ptt.cc), 來自: 180.217.248.198 (臺灣)\n※ 文章網址: https://www.ptt.cc/bbs/Stock/M.1728477929.A.3FB.html\n",
        "TIME": "Wed Oct  9 20:45:27 2024",
        "MESSAGE_ALL": 0,
        "BOO": 0,
        "PUSH": 0,
        "MESSAGE_COUNT": 0,
        "NEUTRAL": 0,
        "TAG": "標的"
    },
    "[標的] 4995 晶達 冷門多": {
        "STOCK_ID": "4995",
        "TITLE": "[標的] 4995 晶達 冷門多",
        "ID": "M.1728481491.A.049",
        "LINK": "https://www.ptt.cc/bbs/Stock/M.1728481491.A.049.html",
        "AUTHOR": "Efrenxx",
        "CONTENT": "作者Efrenxx (西松費德勒)看板Stock標題[標的] 4995 晶達 冷門多時間Wed Oct  9 21:44:49 2024\n\n標的：4995 晶達\n\n\n分類：冷門多\n\n\n分析/正文：\n\n4995這檔版上有位a08大大發過，\n當時的文章已經介紹了不少東西，\n公司專注於客製化高亮度面板的利基型市場。\n\n10/7公布完9月營收，能大概算出Q3 eps約落在1.5左右，Q1賺1.01、Q2賺1.4，\n從公司受訪的說法，今年有拿到新加坡、台灣的軌道交通新訂單，去年波蘭的鐵路訂單也已\n量產陸續出貨中，\n單子狀況都是成長的情況下，\nQ4表現我保守估最差能和Q2持平，\n全年預計的EPS應該能超過5，\n寫下歷史新高的獲利。\n\n股價現在70-80之間震盪整理，市場目前trade它的本益比約在14-16，\n回歸近五年：\n2019 epss4.14 最高價trade的本益比在13.5\n2020>30.6\n2021>14.7\n2022>8.84\n2023>15.5\n\n以此來推，目前14-16的本益比如果在產業沒有成長或公司沒有持續拓展新業務的情況下，\n算是「合理」的區間，\n但這也意味可能沒有反應到25-26年可預見的成長，\n尤其這種低量冷門股很常沒能反應實際價值，我自己特別喜歡找這種，\n就算市場沒什麼人氣，殖利率也能接受，\n主要這家公司還算務實，籌碼也安定，\n前十大股東都是公司內部人、關係人，抱的相對安心。\n\n補充我所能掌握到的成長動能，\n包括公司開始切入電子紙、膽固醇液晶等新產品，\n今年拿下的新的標案（亞洲），\n對於原本亞洲營收貢獻相對小的狀況來說，算是不錯的拓展，\n在博弈機台方面，\n除了原本就掌握的前三大博弈機台供應商之一（我自己猜應該是美國的IGT)，\n今年在日本也有新的博弈機台客戶，\n尤其如果電子紙那塊切入的順利，市場trade的本益比有機會再提高，\n抓幾個同業或類似產業的本益比：\n8069約30-33倍、6143約20-25倍，\n雖然不能跟龍頭大咖相比，\n但4995有研揚、華碩的關係背景，\n所以我蠻樂觀看待後市，抓個低標也應當有20倍。\n\n因為身邊在研究股票的人不多，\n喜歡找冷門標的的人更是少，\n所以上來股版發文，拋磚引玉，\n希望能有高手不吝賜教、指導小弟，\n我還沒辦法很有信心的認定自己的研究、分析方法是正確的，\n如果版上有對4995、這個產業或是也常查找冷門股找更多超額報酬的交易機會，\n可以站內信交流一下，謝謝！\n\n參考資料：CMoney、XQ盤後資料系統、晶達2023年報、工商時報、經濟日報\n\n附一篇最近提及晶達的新聞：\nhttps://www.ctee.com.tw/news/20240617700126-430502\n\n\n進退場機制：\n\n預期25、26年公司仍能有雙位數成長，\n每季度能賺1.4~5元，一年估6塊，\n目標價應該能到120以上吧？！\n\n如果Q3季報、未來營收都有如自己估的，會持續加碼，\n至少抱到明年底，\n但若成長表現不如預期（如：營收大幅衰退、單季獲利未達1.4以上）就會出場。\n\n最後附上自己的奈米單：\nhttps://i.imgur.com/Kqk4AwT.jpeg\n\n懇請產業先進、股市前輩，如有指教，歡迎站內信，感謝！\n\n\n--\n※ 發信站: 批踢踢實業坊(ptt.cc), 來自: 39.9.188.117 (臺灣)\n※ 文章網址: https://www.ptt.cc/bbs/Stock/M.1728481491.A.049.html\n噓 YesNoter    : 羨慕有a08-etf10/09 21:47\n→ a0808996    : 那個a08 我之前跟單 都賠錢 你信他..... 保重10/09 21:50\n查了一下發現是文章本尊，a大您好\n噓 nicehuman   : 幫低調10/09 21:52\n推 vanii40     : A08菲特大獲全勝10/09 21:59\n噓 fdkevin     : 幫a08低調10/09 22:00\n→ Efrenxx     : 我其實根本不知道a08發了多少標的和他又是誰…  10/09 22:14\n→ Efrenxx     : 只是在版上找這檔相關文章的時候有看到他的文而已10/09 22:14\n※ 編輯: Efrenxx (39.9.188.117 臺灣), 10/09/2024 22:16:02\n→ iamacomic   : 你多用這個選股邏輯去選很容易會跟a08菲特疊到10/09 22:18\n推 hensel      : a08低調賺爛ETF10/09 22:32\n※ 編輯: Efrenxx (39.9.188.117 臺灣), 10/09/2024 22:43:31\n推 a0808996    : 我是覺得這檔大概就跟2022 賺得差不多 10/09 22:53\n→ a0808996    : 要其他營收會噴 機率挺低的 10/09 22:53\n推 a0808996    : *期待 10/09 22:56\n噓 joestoman   : 持股被點名幫低調 10/09 22:59\n→ joestoman   : 2020年3X塊開始買,可惜買不多,就爆漲勒 10/09 23:02\n",
        "TIME": "Wed Oct  9 21:44:49 2024",
        "MESSAGE_ALL": 14,
        "BOO": 4,
        "PUSH": 4,
        "MESSAGE_COUNT": 0,
        "NEUTRAL": 6,
        "TAG": "標的"
    },
    "[標的] 2887 不怕夜長夢 多": {
        "STOCK_ID": "2887",
        "TITLE": "[標的] 2887 不怕夜長夢 多",
        "ID": "M.1728475230.A.603",
        "LINK": "https://www.ptt.cc/bbs/Stock/M.1728475230.A.603.html",
        "AUTHOR": "bear520ju",
        "CONTENT": "作者bear520ju (嵐鯨)看板Stock標題[標的] 2887 不怕夜長夢 多時間Wed Oct  9 20:00:28 2024\n標的：\n2887 台新金\n\n分類：多\n\n分析/正文：\n\n台灣金融史上首樁合意的金控合併案通過惹\n\n不管是否原本支持新新併，反正生米煮成熟飯\n身為無情的賺錢機器，單就投資角度來分析新新併：\n\n#增強盈餘能力\n合併後將擁有更廣泛的產品線與更強的資源整合能力，有助於提高服務品質並吸引更多的\n客戶，可值得期待能持續獲得穩定報酬率\n\n#擴大規模提升競爭力\n合併後的規模經濟效應有機會有效降低運營成本，提高經營效率，進一步提升公司在市場\n中的競爭力，可增加股東的長期收益，還可讓公司在面對市場變化時保持靈活性和抗風險\n能力\n\n#銀行合併後辦業務更方便（超務實的一點XD\n全家多是台新的ATM，而且網銀好操作又方便，新光銀的客戶也可以期待以後刷本本更方\n便；加上林口沒有台新分行只有新光（林口人請舉手）合併後辦業務就不用跑到台北惹！\n！（最後一點亂入）\n\n總之，合併後銀行、保險業務的規模與市占會顯著提升，帶來更強的市場競爭力與發展潛\n力，代表著更強大的經營基礎及持續成長的機會！\n\n坐四望三不是說說，趁現在低點建倉是最佳時機\n\n--\n※ 發信站: 批踢踢實業坊(ptt.cc), 來自: 1.200.33.95 (臺灣)\n※ 文章網址: https://www.ptt.cc/bbs/Stock/M.1728475230.A.603.html\n噓 blackpork   : 288810/09 20:01\n※ 編輯: bear520ju (1.200.33.95 臺灣), 10/09/2024 20:02:19\n推 lucky466    : 2887是台新金10/09 20:02\n嗚嗚新光台新都看漲辣 打錯惹抱歉\n※ 編輯: bear520ju (1.200.33.95 臺灣), 10/09/2024 20:03:14\n→ bear520ju   : 反正新光台新合併要變一家了啦XD 10/09 20:03\n推 CCPenis     : 瓜農要來進攻了 恐怖情人很氣 10/09 20:04\n推 tp6u04cj86  : 夜長夢多 雙倍起跳噴 10/09 20:07\n推 k1245963    : 亮哥笑嘻嘻 但狗狗股利是真ㄉ發ㄉ大方 10/09 20:08\n推 baddaddy    : 大旱等合併成功後才是低點吧 10/09 20:08\n推 billpk11    : 我股市小白有10張台新金請教合併後只是股票名稱改 10/09 20:10\n推 gladiator303: 現在真的是合併前的地板價了 趁早進場ㄎ 10/09 20:10\n→ billpk11    : 而已嗎? 10/09 20:11\n→ ken86084    : 簡單算了一下合併後淨值17.8 10/09 20:16\n",
        "TIME": "Wed Oct  9 20:00:28 2024",
        "MESSAGE_ALL": 11,
        "BOO": 1,
        "PUSH": 7,
        "MESSAGE_COUNT": 6,
        "NEUTRAL": 3,
        "TAG": "標的"
    },
    "Re: [標的] 台指期 多單 26口 大台 2024/10/07": {
        "STOCK_ID": "2024",
        "TITLE": "Re: [標的] 台指期 多單 26口 大台 2024/10/07",
        "ID": "M.1728462054.A.BB6",
        "LINK": "https://www.ptt.cc/bbs/Stock/M.1728462054.A.BB6.html",
        "AUTHOR": "tosay",
        "CONTENT": "作者tosay (12333)看板Stock標題Re: [標的] 台指期 多單 26口 大台 2024/10/07時間Wed Oct  9 16:20:52 2024\n※ 引述《YAYA6655 (YAYA)》之銘言：\n: 26口大台真的很猛\n: 26*200=5200\n: 5200*300點 =156萬 這心臟也太猛\n: 記得以前D神說過，真正夠格稱為大戶的，至少可以留倉十口大台\n: 當時指數還是七八千點而已，現在兩萬二，26口相當於D神說的52口波動\n: 我自己最多留倉一口小台晚上就睡不著了，會偷看美股\n: 還好最近有微台，一口微台勉強可以晚上不偷看美股，跟他拼到底\n: 大大你太神啦\n\n\n  我剛剛有對帳單 文章刪掉了\n\n  因為裡面出現 另一個阿文 (剛剛應該不少網友看到)\n\n  我不刪我怕 我自己花時間跟這咖喇起來\n\n  所以本篇抱著被噓就被噓的\n\n  你的心情  我觸動了一些所以還是回一下\n\n  你的心情 我懂  我們常常在說的 為什麼要對部位的控制\n\n  以及我對阿文說的  只要他願意抱個三五口大台過個三五天\n\n  我以後都站她那邊  你抱過單才知道人家為什麼值得被尊敬\n\n  整天在那邊 A 轉是成不了氣候的\n\n  抱過單 才知道 波動對自己的影響\n\n--\n※ 發信站: 批踢踢實業坊(ptt.cc), 來自: 125.229.102.9 (臺灣)\n※ 文章網址: https://www.ptt.cc/bbs/Stock/M.1728462054.A.BB6.html\n推 qa1122z     : 通常吃不下睡不著就是超過極限惹 10/09 16:22\n→ qa1122z     : 手中有單心中無單談何容易 10/09 16:22\n→ qa1122z     : 尤其是重鴨時 10/09 16:23\n推 IdolYang    : 曾經抱五口小台扛了一千點的我感同身受 10/09 16:26\n推 WSLai       : 怎麼跌也不會回1萬，怕甚麼 10/09 16:27\n→ IdolYang    : 慶幸自己當時離結算還有10多天 10/09 16:27\n推 killerjack  : 那個阿文就是個在鬧版的破幹垃圾 10/09 16:27\n→ qa1122z     : 明天國慶，怕出現大場面，大概很多人減碼 10/09 16:29\n→ qa1122z     : 有沒有賭癮很大的加碼等開獎的？ 10/09 16:30\n推 mypower     : 國慶看賴哥講話阿！ 10/09 16:36\n→ brain9453   : 愛豆太扛了吧 10/09 16:39\n→ a069275235  : 這什麼文= =  主辦單位管一下好不好… 10/09 17:27\n推 c928        : 個版發洩文 10/09 17:33\n→ fookafook   : 阿文標的 https://shorturl.at/eZi7e 10/09 17:38\n",
        "TIME": "Wed Oct  9 16:20:52 2024",
        "MESSAGE_ALL": 14,
        "BOO": 0,
        "PUSH": 6,
        "MESSAGE_COUNT": 6,
        "NEUTRAL": 8,
        "TAG": "Re標的"
    },
    "[標的] 2316楠梓電 中國一定強 當沖多": {
        "STOCK_ID": "2316",
        "TITLE": "[標的] 2316楠梓電 中國一定強 當沖多",
        "ID": "M.1728435211.A.52E",
        "LINK": "https://www.ptt.cc/bbs/Stock/M.1728435211.A.52E.html",
        "AUTHOR": "c98765432c",
        "CONTENT": "作者c98765432c (ccc)看板Stock標題[標的] 2316楠梓電 中國一定強 當沖多時間Wed Oct  9 08:53:29 2024\n標的：2316 楠梓電 中國概念股\n\n分類：今天當沖多\n波段多前天發文成本抓54-55進場續抱\n\n分析/正文：\n1.昨天只是中國etf溢價回歸校正不用擔心\n\n2.金酒銀十都砸錢爆拉，怎可能只拉一波？\n\n3.加計護墊淨值90，上次買淨值比這麼低的大概就是130的長榮、45以下的台塑，送分題\n\n4.量能出來了今天當沖幫忙波段單洗量 ，進可攻退可守\n\n進退場機制：\n當沖多54-55停利58停損52（當沖）\n\n波段續抱不停損目標70以上\n\nhttps://i.imgur.com/FM8U6uG.jpeg\n\n\n--\n※ 發信站: 批踢踢實業坊(ptt.cc), 來自: 101.12.207.229 (臺灣)\n※ 文章網址: https://www.ptt.cc/bbs/Stock/M.1728435211.A.52E.html\n→ ann16       : 完全都沒單 連一股也買不起在迪卡四處發文的咖 10/09 08:56\n推 tmdl        : XDDD 10/09 09:00\n噓 tttt0204    : 一樓在說自己嗎 嘻嘻 10/09 09:00\n→ ann16       : 別人好歹會盜盜圖 甚至買1股 你完全都沒單 當大家沒 10/09 09:01\n→ ann16       : 腦袋阿 10/09 09:01\n噓 operatorm   : 沒單C螺,苦澀保羅,剛彈阿姆羅→青眼究極騾 10/09 09:06\n噓 z1231002    : 你的中國崩爛了 10/09 09:11\n推 wer0241     : Id不對 10/09 09:17\n推 chinaeatshit: ID 10/09 09:18\n噓 wayne6250   : 腦袋空空多 10/09 09:24\n推 iahc5566    : 陳爸救命 10/09 09:47\n噓 jack18262   : 每個地方都有這種沒單的小丑到處亂喊  到底有啥意義 10/09 09:49\n噓 z789252     : 喊完樓下可以放空了 10/09 09:57\n推 siekensou000: 跟股市同學會一樣類型的文章== 10/09 09:59\n噓 kumafez     : 沒單跟人家發啥標的文 洗洗睡吧 10/09 10:11\n噓 DickJeter   : 加計滬電淨值90？你那邊還來得及買海運 這種程度的 10/09 10:28\n→ DickJeter   : 算了吧 10/09 10:28\n→ FlutteRage  : http://i.imgur.com/ukah0bE.jpg 10/09 10:33\n推 sonic37     : 散戶太多衝不上去了 10/09 10:59\n噓 z1231002    : 停損了嗎 10/09 10:59\n噓 mnhyuiop    : 沒單仔整天在那蹭 10/09 11:15\n→ GN02209611  : 好歹也買個50股 10/09 12:13\n噓 PalmAngels  : 單？ 10/09 12:37\n推 smbtomas    : 陳爸2000張你們在忙什麼 10/09 13:10\n",
        "TIME": "Wed Oct  9 08:53:29 2024",
        "MESSAGE_ALL": 24,
        "BOO": 11,
        "PUSH": 7,
        "MESSAGE_COUNT": -4,
        "NEUTRAL": 6,
        "TAG": "標的"
    },
    "Re: [標的] 國泰20年美債00687B 多 考慮出手": {
        "STOCK_ID": "0068",
        "TITLE": "Re: [標的] 國泰20年美債00687B 多 考慮出手",
        "ID": "M.1728396595.A.055",
        "LINK": "https://www.ptt.cc/bbs/Stock/M.1728396595.A.055.html",
        "AUTHOR": "ann16",
        "CONTENT": "作者ann16 (NNNNNNNNN)看板Stock標題Re: [標的] 國泰20年美債00687B 多 考慮出手時間Tue Oct  8 22:09:53 2024\n※ 引述《ann16 (NNNNNNNNN)》之銘言：\n: ※ 引述《ann16 (NNNNNNNNN)》之銘言：\n: : 標的：國泰20年美債 00687B\n: : (例 2330.TW 台積電)\n: : 分類：多\n: : (請選擇並刪除無關分類)\n: : 分析/正文：\n: : https://i.imgur.com/PBaeiAr.jpeg\n: : 美債被對折吹死了\n: : 今晚開數據，美債直接崩到31.5\n: : A33多頭大將軍開示等台股24500-25000，反手去美債搶錢\n: : 等不及的人，今晚開數據後，明天美債崩到31.5可以買一點\n: : 我等十月出手買美債 到時候再貼成交單\n: : 美債不是拿來賺錢的，是拿來鎖住台股獲利，然後加減賺一些小錢，等台股回檔直接\n債\n: 轉\n: : 股\n: : 進退場機制：明天31.5檢 或者等到十月再出手檢 笑死人投資美債沒人再停損的 穩\n賺\n: 不\n: : 賠\n: : (非長期投資者，必須有停損機制。討論、心得類免填)\n: 我一次統一說美債進場時機點，符合其一就可以\n: 1.大概台股24-25000\n: 2.美國大選完，確認經濟數據是否回歸\n: 3.00687跌倒31以下\n: 請大家告訴大家！我們一起去賺錢，大四房 保時捷 正妹 小鮮肉 一次滿足\n\n\n連跌一個月太厲害了\nhttps://i.imgur.com/JrpIfgh.jpeg\n\n我喊了三週\n\n我從美債99.8喊到94\n\nhttps://i.imgur.com/HXgMBZp.jpeg\n當時99我就看跌倒96，一路下秀倒93\n\n內資 大媽 黑手！全力要上24500！\n\nA33多頭大將軍，用美債展示什麼是轉折之王！00687我們30.5-31入場\n\n\n美債正二8-8.3入場\n\n明天台積最後上車機會\n\n夢到台積九月營收非常好！\n\n\n台股本週23500！月底24500\n跟著我大聲喊！恐慌蛙蹦蹦叫！台積 富邦 國泰 長榮 漲停嘎到爆！\n\n多蛙本週約妹小帥弟齊看房！\n\n本週00687看見31，下週剩30\n\n所以我才說，股市末升段，趕快來志賺錢\n\n美國要選舉，數據做得好\n\n華爾街配合殺美債下去\n\n麻煩恐慌蛙大聲一點！沒有你們股市怎麼會漲\n\n升息股市繼續噴\n\n股市只有一個字 就是噴！\n美債只有一個字 就是崩！\n\n股市不會跌\n\nhttps://i.imgur.com/BnwWdrz.jpeg\n\n\n\n\n\n\n\n\n\n\n\n\n\n\n\n\n\n--\n※ 發信站: 批踢踢實業坊(ptt.cc), 來自: 203.145.95.189 (香港)\n※ 文章網址: https://www.ptt.cc/bbs/Stock/M.1728396595.A.055.html\n噓 anti87      : 來股版的人要的都是一天40.50趴的投資報酬率10/08 22:12\n→ anti87      : 你那美債一年才3.4趴報酬率....10/08 22:12\n送分體 只是報酬不佳\n噓 tony870414  : YU畫線？？？10/08 22:12\n※ 編輯: ann16 (203.145.95.189 香港), 10/08/2024 22:13:30\n→ anti87      : 我看妳別來股市，去佛寺好了10/08 22:13\n→ a069275235  : 特赦a33！ 叭~~~~~10/08 22:13\n→ Freedombom  : 所以到底現在要買股還是債，大大我好亂R10/08 22:14\n還沒出手 我出手會貼成交單\n※ 編輯: ann16 (203.145.95.189 香港), 10/08/2024 22:15:06\n噓 smartken    : 滾10/08 22:19\n99債蛙\n推 yellone741  : 99本債蛙QQ10/08 22:20\n長期投資是穩賺不賠\n※ 編輯: ann16 (203.145.95.189 香港), 10/08/2024 22:22:06\n推 fbiciamib123: https://i.imgur.com/am7zQ9M.jpeg 三年還沒解套10/08 22:24\n→ baseken     : 債蛙不喜歡這篇10/08 22:24\n→ wr          : 我覺得美債想買的可以慢慢買進 畢竟美債死不了10/08 22:26\n→ s973311     : 可以開始慢慢建倉了吧10/08 22:28\n參考我那篇文章\n可以\n但我還沒買 買了會貼單\n※ 編輯: ann16 (203.145.95.189 香港), 10/08/2024 22:31:05\n推 xephon      : 美國真好心送分題給散戶賺呢 10/08 22:44\n→ xephon      : 全世界央行都在減持美債，就散戶一直幹進去10/08 22:44\n→ ColdM       : 又瘋了一個 10/08 22:46\n噓 northsoft   : 蛙呀蛙呀蛙10/08 22:57\n→ abdetom     : 可以出書、開課程了 10/08 23:27\n好謝謝你\n噓 fivemoonsky8: https://i.imgur.com/xLDyF2B.jpeg 10/08 23:48\n噓 workhardplz : 呵呵 10/08 23:52\n噓 angusyu     : 這麼會畫線要不要考慮當神棍10/09 00:06\n→ RTX3080TI   : https://i.imgur.com/fBYrew9.jpeg10/09 04:33\n推 mini178     : 哈哈 不夠嗨 要更聳動一點 10/09 05:12\n噓 ze810125    : https://i.imgur.com/m92dZyK.png 蘇胡10/09 05:24\n噓 WusoAiwen   : 那你的長榮什麼時後500？ 10/09 06:40\n年底希望可以\n噓 barryliou01 : 你先救長榮吧10/09 07:38\n幹嘛救 發文漲到現在\n噓 guowei616   : 好嚕啦 你73.6的陽明 9.7的1314勒10/09 07:42\n還在啊 也加碼陽明了\n噓 a12587455   : 財富對折 10/09 08:07\n推 ptt20210726 : 感覺這種文章是在玩當沖 10/09 08:20\n※ 編輯: ann16 (203.145.94.116 香港), 10/09/2024 08:58:59\n→ Sukid       : 盜盜盜 10/09 13:22\n",
        "TIME": "Tue Oct  8 22:09:53 2024",
        "MESSAGE_ALL": 29,
        "BOO": 12,
        "PUSH": 5,
        "MESSAGE_COUNT": -7,
        "NEUTRAL": 12,
        "TAG": "Re標的"
    },
    "Re: [標的] 2615萬海抄底當沖多  山托兒多": {
        "STOCK_ID": "2615",
        "TITLE": "Re: [標的] 2615萬海抄底當沖多  山托兒多",
        "ID": "M.1728444101.A.6CB",
        "LINK": "https://www.ptt.cc/bbs/Stock/M.1728444101.A.6CB.html",
        "AUTHOR": "tamama000",
        "CONTENT": "作者tamama000 (GrandFatHouse崇皇肥肥)看板Stock標題Re: [標的] 2615萬海抄底當沖多  山托兒多時間Wed Oct  9 11:21:38 2024\n※ 引述《cailon (我不一定是我!)》之銘言：\n: 今天9:00剛好客戶來取貨\n: 結果打開app東友已經接近漲停了\n: 根本來不及下單\n: 原本不想操作的\n: 但是看到有人出來打臉\n: 阿肥只好硬著頭皮當沖一下\n: 不然等等被當無單仔\n: 阿肥早就說過啦\n: 為什麼還會有人信無單仔勒\n: 阿肥天天po粉絲也沒破十萬啊\n: 本來還想辦個10萬粉絲Q & A\n: 啊先貼個單\n: https://i.imgur.com/RAQz2br.jpeg\n: 感謝小精金突然拉上去\n: 讓阿肥今天晚餐又又又又又又又有了\n: 明天阿母說要拜重陽節\n: 所以阿肥明天沒有台股埋單沒關係\n: 但是阿肥明天有貢品可以吃\n: 就不勞煩大家擔心了\n: 總之\n: 當沖就是不要貪心\n: 賺點便當錢\n: 晚餐吃得好\n: 當沖沒煩惱\n: 阿肥真的真的很不會操作波段…\n: 也沒在什麼停損留倉的啦\n: 還是每天幾百1000的\n: 晚餐錢入袋\n: 白天被老闆靠背\n: 晚餐感謝台股賞飯吃\n: 這不，一天又過了\n: 明天10號阿肥又可以領28k了開心\n: 喔明天放假，今天老闆一定又靠背我們\n: 叫阿肥今天一定要把客戶的貨出完\n: 就這樣吧\n: 阿肥去當社畜了\n\n如題\n\n上證蛙 空蛙 多蛙 50蛙 +2蛙 債蛙\n\n安安大家好\n\n\n窩乃阿肥便當教司教 肥肥宅\n\n之前有人抱怨肥肥都十張淦進淦出很不親民\n\n肥肥虛心檢討 決定回歸基本教義\n\n少量多餐\n\nhttps://i.imgur.com/avsfBeJ.jpeg\n\n怎麼看進出 不好說\n\n寫得太玄可能又不親民了\n\n反正點位不遮 每一篇拿出來比較一下\n\n交叉歸納\n\n大概可以 不一定可以 只是有可能 有人能看出點心得\n\n那就算善事一件\n\n\n\\便當教萬歲/\n\n\n大家午餐吃什麼\n\n底下留言\n\n--\n※ 發信站: 批踢踢實業坊(ptt.cc), 來自: 223.140.179.102 (臺灣)\n※ 文章網址: https://www.ptt.cc/bbs/Stock/M.1728444101.A.6CB.html\n→ EvilJustice : 你這有點弱，阿肥教主等等就來教訓你 10/09 11:24\n推 Feverist    : 便當阿肥又賺爛了 10/09 11:25\n噓 nisi0773    : 離題了吧 人家討論萬海 你自己開一篇比較合理吧 10/09 11:26\n噓 VincentZeda : 好扯 便當肥肥可以這樣每天沖的嗎 10/09 11:45\n噓 reFine      : ㄞ到底要幾篇，文不對題內容空泛的當當沖文，當個版 10/09 12:21\n→ reFine      : ？ 10/09 12:21\n推 SaHEL11     : 越來越像肥肥喔 10/09 12:23\n→ z7956234    : 吃什錦炒麵！ 10/09 13:47\n推 JacksonWu   : 阿肥我偶像,不過還是自己開一篇會比較好 10/09 14:59\n",
        "TIME": "Wed Oct  9 11:21:38 2024",
        "MESSAGE_ALL": 9,
        "BOO": 3,
        "PUSH": 3,
        "MESSAGE_COUNT": 0,
        "NEUTRAL": 3,
        "TAG": "Re標的"
    },
    "[標的] 2211 TW 長榮鋼討論": {
        "STOCK_ID": "2211",
        "TITLE": "[標的] 2211 TW 長榮鋼討論",
        "ID": "M.1728396810.A.6F8",
        "LINK": "https://www.ptt.cc/bbs/Stock/M.1728396810.A.6F8.html",
        "AUTHOR": "SaiWan",
        "CONTENT": "作者SaiWan (saiwan)看板Stock標題[標的] 2211 TW 長榮鋼討論時間Tue Oct  8 22:13:28 2024\n標的：2211 TW 長榮鋼 \n\n分類:討論\n\n分析/正文：\n籌碼面看起來是空的：\n1.股票從高點156左右跌下來到現在112.5。每次偶然漲一天3%以上後過沒幾天就跌下來。\n已經在120少下盤整幾個月，這幾天又更低跌到112.5。\n\n2.主力買盤都是919，但目前919已經買了四萬多張，按照不能買超過單一個股10%的上限\n，其實也快買滿了。\n\n3. 承2，買盤多依賴919，外資已經連N天賣出，外資的賣壓就是股票跌的元兇，同時因為\n大戶持股佔了8成以上，所以只要幾百張的量就可以影響漲幅。\n\n4.借券餘額跟借券賣出餘額持續增加。已經跌了一段還是持續增加\nhttps://i.imgur.com/dhaCyGa.jpeg\n\n5.人氣低落外資不親睞，目前沒有買盤讓他上去\n\n基本面還算多\n1.鋼構本業今年算不錯比去年好，未來在手訂單也是令人放心。\n\n2.欣榮9月底整改完成，未來燒垃圾量可望提升，還有發電收入\n\n3.生質能中心已經營運一陣，配上欣榮整改完成後可望提升事業廢棄物的業務。\n\n4.明年長榮航、長榮海的股利按理說比今年好。好不少。\n\n5.今年估全年EPS大概坐6望7。\n\n6.明年EPS有望9元以上。\n\n請問這隻大家怎麼看。目前還是有賺，從高點下來到現在已經少了一台車了。也不知道該\n留還是該跑。雖然說看長一點基本面營運狀況是不錯，但就怕基本面不會反應上去。有無\n了解這隻的人分享意見呢，感謝。\n\n\n\n\n--\n※ 發信站: 批踢踢實業坊(ptt.cc), 來自: 220.132.104.50 (臺灣)\n※ 文章網址: https://www.ptt.cc/bbs/Stock/M.1728396810.A.6F8.html\n※ 編輯: SaiWan (220.132.104.50 臺灣), 10/08/2024 22:14:33\n推 zerro7      : 之前120-125撐蠻久的 一破120就快到110了QQ 10/08 22:14\n推 ann16       : 我老大當時100初全出光停利換長榮海繼續賺到現在給 10/08 22:15\n→ ann16       : 你參考 10/08 22:15\n推 devidevi    : 先出，等站上線再買回 10/08 22:17\n推 IanLi       : 這還是看自己的策略還有沒有其他佈局的資金需求， 10/08 22:18\n→ IanLi       : 不然成本50到60元的沒啥差，現價也是從偏貴回正常 10/08 22:18\n→ IanLi       : 區間。 10/08 22:18\n推 ibanes      : 還在想有關鍵字會不會有靈體，果然XD 10/08 22:23\n→ SaiWan      : 零體是啥 10/08 22:24\n→ SaiWan      : 靈體 10/08 22:24\n推 rz2x        : 靈體是股版一個瘋狂喊長榮的人的分身 10/08 22:26\n推 rz2x        : 這隻我認為應該不是用本益比15~20倍去算，而是用5% 10/08 22:29\n→ rz2x        : 殖利率去算價位吧，台股現在5%就算高殖利率股，殖利 10/08 22:29\n→ rz2x        : 率高於5%且基本面良好的股票會被ETF拉到殖利率低於5 10/08 22:29\n→ rz2x        : %以長榮鋼 10/08 22:29\n推 ann16       : 分靈體=分身 去各大水桶文下面都也很多分靈體 10/08 22:30\n→ vcLong      : 這擋問題就是沒成交量 很怕919調整或剔除就完了 10/08 22:30\n→ SaiWan      : 真的 跟713一倒貨就上不去一樣 10/08 22:30\n推 rz2x        : 以80%盈餘分配率來算的話，今年假設EPS 7，明年股利 10/08 22:31\n→ rz2x        : 應該會是5.6元，5%下去算，股價是112 10/08 22:31\n→ nanako81240 : 60-70賣了他之後就沒理過他了 10/08 22:36\n推 hutten      : 1.連續兩年Q4營收差2.月K正在回波段UB再破106機率高 10/08 22:49\n→ hutten      : （還得經歷MACD死亡交叉數月）3.最終還是會填息，花 10/08 22:49\n→ hutten      : 多久時間不知道。4.短線超跌若本月營收開得好可以再 10/08 22:49\n→ hutten      : 彈一下。 10/08 22:49\n→ SaiWan      : 樓上h大意思是短空長多嗎 10/08 22:51\n推 RosS1234321 : 捏到接近140全出 10/08 22:54\n→ SaiWan      : 我也希望有機會回到接近140 10/08 22:56\n推 kitsune50   : 懷念當年每天等垃圾車的日子 10/08 23:21\n推 bigguy      : 漲太多 100-140分好多次出光 回到100以下 10/08 23:23\n→ bigguy      : 再補回嘍 10/08 23:23\n推 krezev      : 我14x就出光了，看能不能再下來再來玩 10/08 23:26\n推 hypolen     : 等明年吧 高點早過了 10/08 23:44\n推 tortoise2006: 14x出完+1，等台股修正時再來撿回來 10/08 23:50\n→ ej03xu3     : 00713潛力股 10/09 00:49\n→ SaiWan      : 才剛被713剔除，難道713會吃回頭草？ 10/09 05:25\n推 SimACC      : 沒啥有趣的題材，等護城河更深了大人才會青睞吧 10/09 08:30\n推 rz2x        : 股價下跌，殖利率上升，713就會回來了，可預期明年 10/09 08:35\n→ rz2x        : EPS會很高，應該有機會回來 10/09 08:35\n→ fday        : 去看看本業營收可貢獻多少吧 10/09 08:41\n推 peterrita   : 這隻50-60佈局 120出光就沒理他了 10/09 10:35\n",
        "TIME": "Tue Oct  8 22:13:28 2024",
        "MESSAGE_ALL": 41,
        "BOO": 0,
        "PUSH": 19,
        "MESSAGE_COUNT": 19,
        "NEUTRAL": 22,
        "TAG": "標的"
    },
    "Re: [標的] MSFT空 GOOG、AMZN多": {
        "STOCK_ID": 0,
        "TITLE": "Re: [標的] MSFT空 GOOG、AMZN多",
        "ID": "M.1728386058.A.A4B",
        "LINK": "https://www.ptt.cc/bbs/Stock/M.1728386058.A.A4B.html",
        "AUTHOR": "qxxrbull",
        "CONTENT": "作者qxxrbull (qxxrbull)看板Stock標題Re: [標的] MSFT空 GOOG、AMZN多時間Tue Oct  8 19:14:14 2024\n※ 引述《qxxrbull (qxxrbull)》之銘言：\n: ※ 引述《qxxrbull (qxxrbull)》之銘言：\n: : 標的：\n: : MSFT空 GOOG、AMZN多\n: : 分類：討論\n: : MSFT空\n: : GOOG、AMZN多\n: : 分析/正文：\n: : MSFT近期走勢很明顯完全漲不動\n: : 440直接被打下來\n: : 與納斯達克100走勢相反\n: : 證實市場已經開始有AI先行者優勢被壓縮的想法\n: : 同時GOOG、AMZN近期的走勢明顯比微軟強\n: : 證實這兩家的AI市場已經開始蠶食鯨吞微軟的優勢\n: : 目前市值\n: : MSFT 3.2兆\n: : GOOG、AMZN 各2兆\n: : 我預估MSFT會下跌至400-380左右 維持2.9-2.8兆的市值\n: : GOOG、AMZN則會將這筆市值吸收\n: : 分別各上漲至2.1-2.2兆的市值\n: : 進退場機制：\n: : MSFT 沽 430 390獲利了結\n: : GOOG 買 164 194獲利了結\n: : AMZN 買 190 210獲利了結\n: : -----\n: : Sent from JPTT on my OnePlus CPH2581.\n: 月底以前至少微軟會看到3字頭\n: http://i.imgur.com/oEZbe5W.jpg\n: 技術分析上日線已經六隻黑烏鴉了\n: 這種線隨便都知道再怎麼樣都不能做多\n: 今天果然開始下跌了\n: 每次都是假拉一段讓你覺得有點希望\n: （禮拜一假拉一段到430 今天直接不演了）\n: 之後下跌的幅度比上漲的多\n: 再加上國際資金從美國輪動到中國的趨勢\n: 這樣的走勢先看到至少399\n: -----\n: Sent from JPTT on my OnePlus CPH2581.\n\n今天已經盤前看到405了\n又再次被降評\n我覺得399算是高估了 這禮拜五以前應該就會看到\n而且看起來準備要直接回去月初起漲點360\n\n覺得大家可以想一下\n「你身邊付錢買Youtube Premium的多\n還是付錢訂閱ChatGPT得多？」\n\n不管前者有沒有移民都算\n我問過身邊非科技業相關人士\n幾乎沒有人有買ChatGPT Plus的\n因為沒有要寫程式日常上根本用不到\n\n那麼以這樣的估值來看\n你覺得值3億還是跟Google一樣差不多只值2億\n可以仔細思考這個道理\n\n\n-----\nSent from JPTT on my OnePlus CPH2581.\n\n--\n※ 發信站: 批踢踢實業坊(ptt.cc), 來自: 101.12.178.43 (臺灣)\n※ 文章網址: https://www.ptt.cc/bbs/Stock/M.1728386058.A.A4B.html\n推 lpmybig     : 我買yt會員捏 10/08 19:17\n→ Fezico      : 我旁邊的全部都有買YTP阿... 10/08 19:18\n→ Fezico      : YTP家庭方案又不認裝置數，一個買全家用有很貴？ 10/08 19:19\n推 speedythief : 我老美同事有幾個有買啦,但對他們來說是小錢玩玩 10/08 19:19\n→ qxxrbull    : 對啊 買YTP的人數遠比ChatGPT還要多 這樣微軟這個市 10/08 19:20\n→ qxxrbull    : 值根本不值 10/08 19:20\n→ super0949   : 那要看企業有沒有要買ChatGPT 10/08 19:21\n→ qxxrbull    : 微軟市值下調回跟Google相近是遲早的事 10/08 19:21\n→ super0949   : 企業是絕對不會幫員工買YT 10/08 19:21\n推 zerro7      : 科技業基本上是人手一個GPT plus吧 搞不好還公費的 10/08 19:22\n→ CorkiN      : 沒有…有的公司都直接鎖了怎麼可能人手一個== 10/08 19:26\n推 MyDice      : 企業用的office跟teams都有copilot的功能 10/08 19:28\n→ jcaosola    : 都買啊...ChatGPT一個月價格可以抵YTP 10個月 10/08 19:28\n→ MyDice      : 幫你draft文章 會議錄音摘要 10/08 19:28\n推 hugh509     : 微軟跌 google也跌，你追我趕 10/08 19:30\n→ Chilloutt   : 99googL 10/08 19:30\n→ dreamwing11 : 拿YT比ChatGPT怎麼有點莫名其妙 10/08 19:40\n→ dreamwing11 : 而且微軟的AI明明就叫copilot... 10/08 19:41\n推 ab4daa      : 都沒買 10/08 19:41\n→ orz811017   : 拜託YouTube premium 對手又不是chargpt..., 10/08 19:51\n→ orz811017   : 而且單人價格大概差10倍欸  而且AI價格還有上調的 10/08 19:53\n→ orz811017   : 潛力 只要更聰明沒什麼不可能的 YT成長性就那樣 每 10/08 19:53\n→ orz811017   : 個人能看電視娛樂時間有限 但AI工作潛力遠遠大得多 10/08 19:53\n噓 ader888     : GOOG的市值是兩兆 10/08 19:53\n→ hillgod     : 有點好笑 10/08 20:05\n推 clecer      : 看openai這輪募資就知道了，只有創投錢太多還在fom 10/08 20:10\n→ clecer      : o 10/08 20:10\n推 pornpig32   : 功能取向不同 拿來比有點奇怪 10/08 20:16\n→ stkoso      : 亂比一通 10/08 20:19\n推 labihua     : 我周遭相反欸 難道是同溫層 10/08 20:31\n噓 e123456ddd  : Office升級Copilot的公司越來越多  YTP是有什麼公司 10/08 20:36\n→ e123456ddd  : 會買？ 10/08 20:36\n推 CaTkinGG    : 怎麼會拿這個比？ 怎麼不比azure 和gcp？ 10/08 20:44\n→ guagua1101  : 光那個office漲價 好貴啊... 10/08 20:57\n推 aegis43210  : 主要是市場不理解明明挖到的金礦那麼少，怎麼還在狂 10/08 20:58\n→ aegis43210  : 買鏟子 10/08 20:58\n推 aegis43210  : FB至少已經在衝刺可以把AI真正變現的手段-元宇宙 10/08 21:01\n噓 NCCUexpert  : 365 + copilot才是微軟的，你扯ChatGPT做什麼? 10/08 21:21\n→ NCCUexpert  : 老哥微軟投資openAI，chatGPT不賺錢算在微軟頭上 10/08 21:22\n→ NCCUexpert  : copilot訂閱人數還在高速成長，數百萬用戶啊哥 10/08 21:23\n→ dary856974  : G的營收什麼時候靠premium了…. 10/08 21:24\n推 QuantumHsia : 瞎掰一堆似是而非的東西，笑死 10/08 21:25\n→ qxxrbull    : 內容是唬爛的 但股價下跌倒是真的 10/08 21:29\n噓 strlen      : 沒料 10/08 21:56\n推 maxisam     : 可能你身邊人都不是什麼高階白領吧 10/08 22:04\n推 maxisam     : 本公司就買Copilot 因為真的太好用 10/08 22:06\n→ strlen      : 生產力工具跟娛樂工具比 那幹麻不說 用windows的人 10/08 22:09\n→ strlen      : 多 還是用chrome的人多？那Google是不是市值5000萬 10/08 22:10\n→ strlen      : 才合理？亂比一通 10/08 22:10\n噓 jatj        : 笑死 360是年初不是月初價 還有微軟是copilot這也不 10/08 22:30\n→ jatj        : 知道 10/08 22:30\n噓 a000000000  : 樓上不要生氣喇   仲介女大生不好嗎 10/08 22:36\n推 melula      : copilot不錯用常常來拿他問目標價  可以幫忙滅火下 10/08 22:41\n噓 richaad     : 年薪不到100的底層，當然不會買這些有的沒的 10/08 22:45\n推 GivemeApen  : 微軟主要還是賣企業端 怎麼會跟ytp比= = 10/08 22:51\n噓 hankyan919  : YTP是啥小舉例笑死 10/09 00:02\n→ jeremytsai  : AMZN也被降評你怎麼不說… 10/09 00:07\n推 ben121196   : 兩個不同的東西 要這樣比哦 10/09 00:22\n→ EvilJustice : 這樣都可以比較...算你有創意 10/09 00:54\n噓 perryppo    : AMZN GOOG MSFT 六個月線圖都差不多 笑死是在玩什麼 10/09 01:28\n→ perryppo    : MSFT 今天落後補漲惹 10/09 01:28\n推 bagaalo     : 回360好啊 趕快加碼 10/09 06:29\n",
        "TIME": "Tue Oct  8 19:14:14 2024",
        "MESSAGE_ALL": 62,
        "BOO": 9,
        "PUSH": 19,
        "MESSAGE_COUNT": 10,
        "NEUTRAL": 34,
        "TAG": "Re標的"
    },
    "[標的] TMF 市場反應過頭多": {
        "STOCK_ID": 0,
        "TITLE": "[標的] TMF 市場反應過頭多",
        "ID": "M.1728396880.A.F25",
        "LINK": "https://www.ptt.cc/bbs/Stock/M.1728396880.A.F25.html",
        "AUTHOR": "newbrain",
        "CONTENT": "作者newbrain ()看板Stock標題[標的] TMF 市場反應過頭多時間Tue Oct  8 22:14:37 2024\n標的：\n TMF \n\n分類：\n 多 \n\n分析/正文：\n標題是慢慢佈局多\n不過我都習慣一次只做一支全壓\n順便每周賺5~10萬佣金，再灌回去買50~100股\n套住，就套著配吧\nhttps://i.imgur.com/HmdlLZu.png\n\n美債20年利率目前4.4%殖利率基本上訂價已過高\n1.就本周所有聯準會官員談話年底訂價仍是 4.33%\n穩健一點的話應該是到選前每周買個1/4比較合理\n\n2.就業市場升降溫不影響聯準會行動，主要在CPI\n\n3.民主黨這次大概輸定了，後面經濟說不定會放推，\n現在又來一個颱風考驗執政能力\n\n\n進退場機制：\n 58以上可先出，也可長持至60以上出，45以下停損\n\n\n--\n※ 發信站: 批踢踢實業坊(ptt.cc), 來自: 1.171.26.248 (臺灣)\n※ 文章網址: https://www.ptt.cc/bbs/Stock/M.1728396880.A.F25.html\n→ strlen      : 用力買 10/08 22:15\n推 alikoko     : 想了解民主黨為何輸定的理由，目前民調看起來是勢 10/08 22:17\n→ alikoko     : 均力敵 10/08 22:17\n→ cheedo      : 推樓上 10/08 22:18\n→ cheedo      : 講個理由吧 10/08 22:19\n推 Dogmeat     : 民調民主黨領先不是? 10/08 22:19\n→ strlen      : 賀副手辯論輸慘 上訪談節目也不知所云被看破手腳 10/08 22:22\n民調還不如賭盤跟股價準XD\n賭盤川領先7.4%\nhttps://i.imgur.com/YCCEihS.png\nDJT谷底反轉暴漲了59%\nhttps://i.imgur.com/3xbE5jA.png\n※ 編輯: newbrain (1.171.26.248 臺灣), 10/08/2024 22:25:29\n推 baseken     : 99債蛙 10/08 22:24\n→ s8752134    : 請教 TMF 怎麼套著配? 10/08 22:25\n推 huan402     : https://i.imgur.com/fmdexoH.jpeg 10/08 22:25\n→ tedliu1024  : 民調勢均力敵是看那台說的？CNN? 10/08 22:26\n推 cheedo      : OK有數據! 10/08 22:26\n推 junior020486: 你這個啊，萬一川普上來搞關稅大外送通膨再起，也 10/08 22:32\n→ junior020486: 是再見 10/08 22:32\n→ junior020486: 到時候中性利率就是4.75-5.0 10/08 22:32\n推 f204137     : TMF 套著配什麼...XD 10/08 22:33\n→ f204137     : 再說一次 要套著配買原型ETF或直債啊 槓桿只有價差 10/08 22:34\n推 ragochen    : TMF是有配息的 10/08 22:34\n我圖上有寫，不是配息XD\n※ 編輯: newbrain (1.171.26.248 臺灣), 10/08/2024 22:35:46\n→ f204137     : 使用TLT 3倍槓桿 也能做到TMF效果 10/08 22:36\n推 EricKuoKuo  : 配權利金 嘿嘿 10/08 22:38\n推 ragochen    : Covered call是一回事，但TMF本身還是有配一點點息 10/08 22:38\n推 joe2        : https://i.imgur.com/fL4pFZJ.jpeg 10/08 22:40\n推 EricKuoKuo  : 賀被看破手腳，口號喊得大聲，面對問題都避重就輕 10/08 22:40\n推 Arnol       : 真的是有點殺過頭 10/08 22:49\n推 aegis43210  : 雙方民調仍是五五波，讓子彈飛一會兒 10/08 23:00\n推 brendon7831 : 滿手DJT…阿川別讓我失望啊 10/08 23:00\n→ z256418     : Tmf是靠TLT+swap交易跟台股的美債正二玩法不一樣啊 10/08 23:03\n→ z256418     : 0.0 10/08 23:03\n→ z256418     : 只不過原op的套著配是指covered call 靠sell call 10/08 23:07\n→ z256418     : 賺權利金 10/08 23:07\n推 smoker1225  : 可是你不覺得利率有可能結束倒掛 10/08 23:21\n→ smoker1225  : 照這樣長天期利率可能到5，越看心越驚 10/08 23:21\n→ speedythief : 賀的聲勢到底是怎麼突然縮掉的?完全沒跟上 10/08 23:35\n推 waitrop     : 大家都知道民主黨跟左謬掌握了所有媒體新聞話語權 10/08 23:36\n→ waitrop     : 甚至在民調方面,民主黨也是每天吹越吹越誇張 10/08 23:36\n→ waitrop     : 然後很神奇的是這一個月,民主黨完全沒聲音了 10/08 23:37\n→ waitrop     : 你去政黑版跟網路搜尋,民主黨跟賀的新聞真的都沒了 10/08 23:37\n→ waitrop     : 甚至連民調領先的新聞在這一個月也都沒看到了 10/08 23:38\n推 huan402     : 為什麼都沒聲音了0.0 10/08 23:38\n→ waitrop     : 所有的新聞都是兩三個月前,這個月所有選舉新聞沒了 10/08 23:38\n→ waitrop     : 我不知道,我只是說出情況,但是我不知道原因 10/08 23:39\n→ speedythief : 有啦,拜登那篇白宮聲明阿,雖然發的讓我覺得很奇怪 10/08 23:39\n→ speedythief : 的確這幾周除了副總統辯論外,沒有其他什大事件 10/08 23:40\n→ waitrop     : 不過我不認為有人放棄選舉,民主黨民調還是領先的 10/08 23:40\n→ strlen      : 該不會建制派倒戈了吧 廢物們趕快原地自殺 10/08 23:41\n→ waitrop     : 我說的民調是新聞跟民主黨之前放出來的民調 10/08 23:41\n推 s881720     : 賀之前不是民調贏嗎 怎麼又崩了 10/08 23:44\n→ aloness     : 會是跟本國一樣，民調封盤了嗎？ 10/08 23:47\n推 goodevening : 我查新聞就連FOX都說賀民調微幅領先 到底川民調領 10/08 23:51\n→ goodevening : 先是哪裡來的 10/08 23:51\n推 Kronecker   : TMF 配息根本九年一毛，連槓桿都不會看的程度ㄏ 10/08 23:54\n→ maplefff    : 為什麼20年期的長債利率是年底的利率作基準 10/08 23:55\n→ maplefff    : 這根本沒關係吧, 怎麼不是25年底, 26年底 10/08 23:55\n推 Sex5F       : 三倍套牢？ 10/08 23:57\n推 waitrop     : 川的民調不可能領先，很多原因，光是普選人數在大 10/09 00:18\n→ waitrop     : 都市就一定輸，再加上現在左謬跟政治正確橫行，沒 10/09 00:18\n→ waitrop     : 人敢說真話，沒人敢說民主黨不喜歡的話，另外媒體 10/09 00:18\n→ waitrop     : 與話語權在民主黨手上，即使是Fox 也是站隊在民主 10/09 00:18\n→ waitrop     : 黨，所以不會有任何川普民調贏的新聞 10/09 00:18\n推 ben121196   : 套牢配 10/09 00:19\n噓 s94516      : 45以下是超讚買點結果停損？？？ 10/09 01:06\n推 richaad     : 民主黨基本上應該是輸了，幾十年來賭盤資金非常準， 10/09 01:33\n→ richaad     : 上週押川普的賭金暴增40多億美 10/09 01:33\n→ RTX3080TI   : https://i.imgur.com/OE46V4u.jpeg 10/09 05:16\n推 mdkn35      : 債蛙早已斷氣 10/09 06:14\n→ ze810125    : https://i.imgur.com/m92dZyK.png 可悲債蛙只能看 10/09 07:23\n→ ze810125    : 收益平準金自爽 10/09 07:23\n噓 davidr      : 第二點 10/09 08:07\n→ bnn         : 美國不能不配息 所以什麼都能套著配(X 10/09 08:16\n推 YJM1106     : 看懂了 因為不能造假數據 所以賀輸的民調就不報新 10/09 08:24\n→ YJM1106     : 聞了 10/09 08:24\n→ YJM1106     : 不能作假 沒說不能不報 10/09 08:24\n→ Bulogal     : 算上11月降息來說，現在美債利率還是領先反應， 10/09 08:38\n→ Bulogal     : 現在買只能套著配而已；tmf跌倒45利率大概很接近4. 10/09 08:38\n→ Bulogal     : 75%左右，如果fed不打算繼續升息跟cpi沒破3往4走， 10/09 08:38\n→ Bulogal     : 放到明年根本穩賺 10/09 08:38\n→ duriel3313  : 如果假設條件一堆也能算穩賺嗎XD 10/09 08:46\n噓 ze810125    : 我廢物債蛙套著配 目前總損益跌到只剩賺50幾萬qq 10/09 08:53\n→ ze810125    : https://i.imgur.com/m92dZyK.png 10/09 08:53\n推 DUFTON      : 會贏喔 10/09 09:04\n推 miyazakisun2: 99美債正二 10/09 09:12\n推 aresa       : 大家是不是不知道密爾頓颶風多猛啊，這基本宣告佛州 10/09 10:48\n→ aresa       : 會有重大災情了 10/09 10:48\n推 waitrop     : 應該不只佛州，東南邊都受傷 10/09 14:05\n",
        "TIME": "Tue Oct  8 22:14:37 2024",
        "MESSAGE_ALL": 84,
        "BOO": 3,
        "PUSH": 31,
        "MESSAGE_COUNT": 28,
        "NEUTRAL": 50,
        "TAG": "標的"
    },
    "Re: [標的] 006206 元大上證50 多": {
        "STOCK_ID": "0062",
        "TITLE": "Re: [標的] 006206 元大上證50 多",
        "ID": "M.1728374482.A.65B",
        "LINK": "https://www.ptt.cc/bbs/Stock/M.1728374482.A.65B.html",
        "AUTHOR": "mangle",
        "CONTENT": "作者mangle (mangle123)看板Stock標題Re: [標的] 006206 元大上證50 多時間Tue Oct  8 16:01:20 2024\n※ 引述《anti87 (鬼島觀察家)》之銘言：\n: 一些人喊著要看我的對帳單\n: https://i.imgur.com/mDOvcVi.jpeg\n: 因為我進場早\n: 板上第一個PO進場陸港股標的文就是我\n: 所以我現在的鹿港股損益還是正的\n: 大約賺半台機車吧\n: 不過元大上證50這ETF真的屎\n: 他媽的漲時漲的比別人少\n: 跌時跌的比別人多\n: 之後會找機會賣掉\n:\n\n\n幫補一張\n\nhttps://i.imgur.com/p5RWFT9.jpeg\n\n這隻我也出掉了，不是不看好中概股，而是溢價太嚴重。\n\n這波中概股浪潮，話說大陸那邊都還沒人踩人，外圍已經在搞互相坑殺，敢進場00887這種的就知道自己是….\n\n不過這獲利趴數很滿意，雖然這隻投入資本不多。\n\n\n\n而今天上海A股還漲到3800，看來開盤搶進的要被套牢一陣子，不過收盤到3600。\n\n這兩週漲太暴力，大概會區間震盪一陣子，要給他洗一下籌碼震盪一下才穩固，再找機會進場，港股也是，連漲三週，國外資金也要輪轉一下，不過今天國新辦講幹話應該是最大的利空了….後續還要觀察大陸貨幣政策執行力道與財政政策的實質內容。\n\n估值過低，隨時加碼港股～只要放個半年都有機會突然暴漲10、20%，很划得來的投資\n\n--\nSent from nPTT on my iPhone 13\n\n--\n※ 發信站: 批踢踢實業坊(ptt.cc), 來自: 111.71.58.142 (臺灣)\n※ 文章網址: https://www.ptt.cc/bbs/Stock/M.1728374482.A.65B.html\n噓 l19900513   : 早說，為什麼不早說 10/08 16:02\n→ GingFreecss : 13.78是真的低 10/08 16:02\n推 cfceo       : 人家只是回補缺口被你說得這麼嚴重 10/08 16:43\n推 VidorGu     : https://i.imgur.com/2wSjYnB.jpeg 10/08 16:56\n→ VidorGu     : 昨天去買車顧著跟業務聊天沒注意到時間 10/08 16:57\n→ VidorGu     : 盤後沒賣到少賺很多，今早開盤不戀棧趕快出脫 10/08 16:58\n推 VidorGu     : 後續應該不會再進了 10/08 16:59\n推 losehope    : 樓上賺到買新車羨慕！ 10/08 17:57\n",
        "TIME": "Tue Oct  8 16:01:20 2024",
        "MESSAGE_ALL": 8,
        "BOO": 1,
        "PUSH": 4,
        "MESSAGE_COUNT": 3,
        "NEUTRAL": 3,
        "TAG": "Re標的"
    },
    "Re: [標的] YANG.US 三倍放空中國ETF 盤前+35%": {
        "STOCK_ID": 0,
        "TITLE": "Re: [標的] YANG.US 三倍放空中國ETF 盤前+35%",
        "ID": "M.1728390082.A.B28",
        "LINK": "https://www.ptt.cc/bbs/Stock/M.1728390082.A.B28.html",
        "AUTHOR": "longkiss0618",
        "CONTENT": "作者longkiss0618 (夏夕夏景)看板Stock標題Re: [標的] YANG.US 三倍放空中國ETF時間Tue Oct  8 20:21:18 2024\n※ 引述《longkiss0618 (夏夕夏景)》之銘言：\n: ※ 引述《longkiss0618 (夏夕夏景)》之銘言：\n: : 這隻因為港股今天暴跌的關係 現在盤前直接+26%到35元\n: : 沒想到短短一個月左右可以漲一倍 先謝謝習大大連任賜我吃穿\n: : 雖然今年中國GDP公布有比上一季好 但個人還是不太看好未來幾年中國跟香港的發展\n: : 所以目前持有的股票應該還是會放著 希望還能再漲上去 不曉得其他人怎麼看?\n: https://i.imgur.com/WhDlxuh.png\n: 這支最近每天都5%5%的漲 原因不用多說 大家都知道\n: 偶爾會有那種1天就漲20%的日子 賭中國最近會爆更大的事的人可以買來玩看看\n: https://i.imgur.com/4TGbgX4.jpg\n: 內扣不低 不建議長期持有\n自從上次發文已經1年了 小弟經常拿美股的閒錢玩這支股票\n\n今天又可以來討論了 自從約1個月前習大大的發言後\n\n這支3倍ETF反向股 直接1個月內閃崩了75% 有人會跳樓的幅度了\nhttps://i.imgur.com/Zl7RNJ3.png\n\n好險那時候就說這支不建議長期持有 早早就賣掉大部分 這個月沒有虧很多\n\n昨天晚上美股一開盤 大概是2.8元左右 想說很低了 就買了900股\n\n加上本來還剩下的100股(吃到-75%的部分) 合計1000股\n\n想說放個2.3個月應該會賺 總會等到中國股市反轉吧?\n\n然後今天早上一看馬上又虧了10%剩2.4元 結果剛剛看了一下 好恐怖:\nhttps://i.imgur.com/Xf3BRHv.jpeg\n\n直接盤前+41% 之前虧的 1天就V回來了\nhttps://i.imgur.com/TAezjM6.jpeg\n\n沒意外 今天就先設定停損 確保獲利可以保證入袋 帶應該還有很大的上漲空間\n\n歡迎賭鬼一起玩這支 這一個月內應該會有很大的波動 美股很好玩的☺\nhttps://i.imgur.com/kMly0uR.png\n\n--\n 1 m爆11/19 longkiss0618 □ [閒聊] 跟7個台灣人打了一場4小時半的世紀帝國\n 2 m爆11/20 doyouknowhow R: [閒聊] 跟7個台灣人打了一場4小時半的世紀帝國\n 3 m爆12/02 Wtaa         R: [閒聊] 跟7個台灣人打了一場4小時半的世紀帝國\n 4 m爆 4/01 Wtaa         R: [閒聊] 跟7個台灣人打了一場4小時半的世紀帝國\n 文章代碼(AID): #1Q4OS40h (C_Chat) https://i.imgur.com/G1rivW6.jpg\n\n--\n※ 發信站: 批踢踢實業坊(ptt.cc), 來自: 36.235.101.197 (臺灣)\n※ 文章網址: https://www.ptt.cc/bbs/Stock/M.1728390082.A.B28.html\n推 ChikanDesu  : 轉折抓的很猛 這比反一難做多了 10/08 20:22\n推 GN02209611  : 這個有猛 10/08 20:24\n→ Fezico      : 畢竟是開三倍槓桿的東西，心臟不行的就別去惹 10/08 20:24\n推 zero7810    : 有賺要走 彈上去再進場 10/08 20:27\n→ sonatafm2   : 一股兩塊美元真的是在玩身體健康的 10/08 20:28\n推 lplpyy      : 太刺激了閒錢玩就好 10/08 20:29\n推 guest0079   : 玩這種跟玩運彩一樣 圖個樂 你又不敢重壓 10/08 20:32\n推 pmes9866    : 我以為SOXL一天波動25%已經夠誇張 直到這波中概 10/08 20:32\n推 waitrop     : 我晚上掛的買單應該是買不到了，我也不想追 10/08 20:36\n推 jerrylin    : VVAAAVVVVAA 10/08 20:38\n推 hugh509     : 你怎麼敢現在加碼，這操作佩服佩服 10/08 20:39\n想說跌很多了 跟買在高點的人比 至少贏70%\n推 herculus6502: 算你狠 10/08 20:40\n推 turndown4wat: 這個會歸零嗎 10/08 20:42\n→ sanos168    : 讚，一起割中國韭菜 10/08 20:47\n推 Iperfection : 支黑就該放空中國賺大錢 送分題不賺沒下次 10/08 20:49\n推 a205090a    : 明天會漲 漲到禮拜四左右淨值和陸股漲幅差不多 10/08 20:49\n推 godog       : 原po BYD adr 進的時間點不錯 賺不少了 10/08 20:50\nhttps://i.imgur.com/BCW1E73.png 識貨喔\n推 INNBUG      : FT夜盤不能交易明天港股漲你就要賠了 10/08 20:50\n推 Iperfection : 一些支黑只喊沒有單 馬的廢物 10/08 20:52\n推 lyenia      : 勝利V 10/08 20:52\n推 carbooming  : 盤前噴到歪 10/08 21:05\n推 dontpushme  : 我有買 只不過提前了兩天買… 10/08 21:31\n→ dontpushme  : 已經先虧了一些 10/08 21:31\n今天下來應該還是有贏10%以上吧\n推 stocktonty  : 賺爛了賺爛了 10/08 21:54\n噓 YADABEAR    : 呵呵 10/08 21:55\n推 Jeff1989    : 昨天買了8000股打算來當樂透的說XD 10/08 22:01\n噓 HardyJJ     : 三小  賭博也來po.. 10/08 22:27\n→ HardyJJ     : 有種all in 我再推回來 10/08 22:28\n不敢當韭留美\n※ 編輯: longkiss0618 (36.235.101.197 臺灣), 10/08/2024 22:29:34\n推 lucien0410  : +40%了 可是我還是套在山頂 QQ 10/09 02:04\n推 WaterLengend: 牛逼 10/09 10:30\n",
        "TIME": "Tue Oct  8 20:21:18 2024",
        "MESSAGE_ALL": 30,
        "BOO": 2,
        "PUSH": 23,
        "MESSAGE_COUNT": 21,
        "NEUTRAL": 5,
        "TAG": "Re標的"
    },
    "[標的] 7779 鍇睿國際 未來多": {
        "STOCK_ID": "7779",
        "TITLE": "[標的] 7779 鍇睿國際 未來多",
        "ID": "M.1728403367.A.A9B",
        "LINK": "https://www.ptt.cc/bbs/Stock/M.1728403367.A.A9B.html",
        "AUTHOR": "yisky",
        "CONTENT": "作者yisky (乳酪三明治餅乾)看板Stock標題[標的] 7779 鍇睿國際 未來多時間Wed Oct  9 00:02:45 2024\n標的：\n7779 鍇睿國際\n\n分類：多/心得\n\n分析/正文：\n身為Ptt老鄉民+死忠LOL豚必須認真分析一下，\npo11身為少數從Ptt版主，到脫離上報公司獨立，一路走到自己公司上櫃這部分立志故事就\n不多說，我針對公司的產品進行分析，\n\n1.電競領域-\n首先他不是養戰隊，一堆人搞錯重點，而是賽事舉辦+轉播方，反而有點像愛爾達電視跟寬\n宏藝術這兩間公司。\n\n而LOL就是電子競技裡面目前流量最高規模最大，說電子競技玩不下去，這句話從14年前聽\n到現在，目前也沒有看到可以取代LOL的遊戲。\n\n明年Riot進行大改革，只留下資本雄厚的戰隊，\n我們賽區明年會加入越南，變成日本、台灣、越南、大洋洲合併成一個賽區，越南因為當初\n假賽風波直接解散，但越南賽區的觀眾數量其實是非常高的（有點像當初台灣職棒），\n所以po11如果吃下越南市場，可以說服台灣公司贊助，讓台廠可以南下打入越南市場或洗白\n形象（亞洲盃或六都模式），這是最快的方法。\n\n2.網路多媒體-\n模式有點類似Hololive，但鍇睿缺少代表性人物，像Hololive三期生或Gura那種，簡單說就\n是都不紅。\n但網路媒體製作是他們的優勢，其他台灣公司沒有他家好。\n\n3.拳賽以及其他領域\n拳擊在台灣一直都是小眾市場，而這幾年運動風氣上升，拳上的成功掌握著流量，吸引很多\n不看拳擊的人，也算是在開發一個新市場，但能走到哪，這部分我不予置評。\n\n另外最近還有新產品Carry能量飲，可以看出這間公司是少數會去抓年輕人喜歡的東西。\n\n隱憂-\n明年的電競館，據說會在台北市區交通最便捷的地方，那個地租成本我不敢想像，雖然Riot\n會補助，但我不知道補助多少，如果Po11看到這篇文請解惑。\n\n\n進退場機制：\n他當初興櫃50元我就覺得太貴了，\n而且台灣人最討厭虧錢的公司，\n剛上興櫃波動大是正常的，\n\n長期投資支持一下嚴董屌擴張\n40元以下進場（我覺得短期會收斂到30左右）\n20元停損\n看好他未來上市櫃故不停利\n\n--\n※ 發信站: 批踢踢實業坊(ptt.cc), 來自: 123.192.154.239 (臺灣)\n※ 文章網址: https://www.ptt.cc/bbs/Stock/M.1728403367.A.A9B.html\n噓 Everforest  : 誰說台灣人最討厭虧錢公司? 你是台灣人? 10/09 00:05\n→ Everforest  : 重點是有沒有fu糗 10/09 00:05\n推 GivemeApen  : 好 買鈊象 10/09 00:05\n推 pewdiepie   : 我ok 你先買 10/09 00:07\n→ pewdiepie   : 你列的這些活動感覺都沒辦法穩定賺錢啊 10/09 00:08\n→ pewdiepie   : 不確定性超大 10/09 00:08\n推 kendavid001 : 沒問題 10元收 10/09 00:09\n推 Chibai5566  : faker退役了還有人要看嗎？ 台灣跟國際實力落差是 10/09 00:10\n→ Chibai5566  : 真的蠻大的 這都是未來收視的利空 10/09 00:10\n推 cjo76223    : 我還是覺得電競的天花板 再高也就那樣 很難有爆炸 10/09 00:14\n→ cjo76223    : 性的發展 10/09 00:14\n推 ben121196   : 俊佳準備回神 別急 10/09 00:16\n推 pmes9866    : PSG幹翻BLG就買 10/09 00:20\n推 BertramL15  : 歐虧 明天歐印 10/09 00:21\n推 gtaped05550 : 丁特買這檔 我來算看看他賠多少了 10/09 00:21\n推 Bachi87     : Psg 打贏Blg會漲停嗎 10/09 00:22\n推 budaixi     : https://i.imgur.com/mtSWOYh.jpeg 10/09 00:24\n推 aa6300158   : 既然你是老玩家，恰巧我也是，就問你，如何變現？ 10/09 00:24\n→ aa6300158   : 我S2還願意花錢進場看TPS圖書館，現在根本不會掏錢 10/09 00:26\n→ aa6300158   : 更正S3。 10/09 00:26\n推 xboxandone  : 這家很會找錢 是不用太擔心。要很賺的話 我保守看待 10/09 00:27\n推 s881720     : 你把錢拿來買這隻跟去訂閱羅傑沒什麼兩樣 10/09 00:28\n→ aa6300158   : 再上一次是MSI進場看faker，國內比賽就省省吧。 10/09 00:28\n推 turndown4wat: 俊嘉文概念股 10/09 00:30\n推 CrazyStone  : 有錢買這隻為什麼不把錢拿去訂閱羅傑，至少還有貼圖 10/09 00:30\n→ CrazyStone  : 刷 10/09 00:30\n推 Waitaha     : 丁特均價多少呀 10/09 00:32\n→ CrazyStone  : 你自己提了三個點：電競是夕陽產業，要靠吃國外市場 10/09 00:33\n→ CrazyStone  : （不確定性大），實況主不紅，拳賽在台灣發展也不予 10/09 00:33\n推 OoWToO      : 這隻只能當彩票吧。投資夢想的。買了就別看損益當支 10/09 00:33\n→ CrazyStone  : 置評，那你到底憑甚麼覺得這是優勢？ 10/09 00:33\n→ OoWToO      : 持 10/09 00:33\n→ CrazyStone  : 坦白講買這支我會寧願拿去買2498，最起碼2498每年還 10/09 00:34\n→ CrazyStone  : 能出新產品賣夢想 10/09 00:34\n推 Tenging     : 買2486也不會買這支 10/09 00:35\n→ s881720     : 而且顏董法說會也沒在ptt宣傳 人家尚凡董仔還會來 10/09 00:37\n→ s881720     : 問鄉民一下 10/09 00:37\n→ KurumiNoah  : 主辦賽事=吃掉越南市場？ 想得太美了吧 10/09 00:37\n推 aa6300158   : 沒明星，沒強隊，沒粉絲，觀眾都來看熱鬧的，罵罵 10/09 00:38\n→ aa6300158   : 白癡賽區，實際上不願意花錢，因為一到世界賽就會 10/09 00:38\n→ aa6300158   : 發現，為什麼要把錢丟在白癡賽區上。 10/09 00:38\n推 hooy2013    : 就問一句，你一年花多少錢在LOL相關產業上 10/09 00:40\n推 z789252     : 烙格尼才搞錯這支個股的重點吧？就問你，現在手遊 10/09 00:40\n→ z789252     : 當道，電腦遊戲的電競比賽還有很多人看嗎？就算手 10/09 00:40\n→ z789252     : 遊的dota 遊戲有電競比賽，真的會有那麼多死忠的粉 10/09 00:40\n→ z789252     : 絲觀看嗎？而且faker退役以後，lol有誰可以跟他一 10/09 00:40\n→ z789252     : 樣出圈嗎？未來lol 的比賽觀看平均年齡層只會越來 10/09 00:40\n→ z789252     : 越高，真的以為觀眾還年輕時間很多嗎？ 10/09 00:40\n推 tsaigi      : 好啦 30勉強收 10/09 00:40\n推 z789252     : 而且國外的賽評搞不好還比台灣的更專業，大家寧願 10/09 00:44\n→ z789252     : 去看其他地區的轉播，加上未來併到東南亞賽區，還 10/09 00:44\n→ z789252     : 要跟國外的轉播單位買轉播權後來播給想聽中文的台 10/09 00:44\n→ z789252     : 灣人看而已，而且也只能聽那些台灣賽評講他們自己 10/09 00:44\n→ z789252     : 開台的內梗，如此排外的轉播人數只會隨著時間越來 10/09 00:44\n→ z789252     : 越少而已 10/09 00:44\n推 ezreal1315  : 手遊剩中國做的能玩 10/09 00:44\n推 tc0417      : https://i.imgur.com/IP9cwFs.jpeg 10/09 00:45\n推 jinx5566    : 自比Hololive滿好笑的，人家有Gura、Pekora、Miko 10/09 00:45\n→ jinx5566    : 鍇睿有誰？  史丹利？湯米？ 10/09 00:45\n→ Minihil     : 這種股票要炒就會漲 要割就是崩 其實不用看獲利了 10/09 00:46\n推 jinx5566    : 鍇睿有誰？  史丹利？湯米？ 10/09 00:47\n→ jinx5566    : 我是覺得有台積電不買，買電動產業 到時候被割韭菜 10/09 00:47\n→ jinx5566    : 真的怨不得誰唷～ 10/09 00:47\n→ Minihil     : IPO來圈錢而已拔 10/09 00:48\n噓 YesNoter    : 看老闆就不想買 10/09 00:48\n→ Muma5566    : 為啥他興櫃能報到50塊啊 資本這麼大？ 10/09 00:48\n推 z789252     : 推這句話：會買這種公司的 建議app全刪了 全部定期 10/09 00:51\n→ z789252     : 投大盤就好 為了你們好 10/09 00:51\n推 gginin7878  : lol這遊戲快不行了吧 10/09 00:51\n推 noleese     : 感覺可以做空 會贏 10/09 00:52\n推 kusorpg     : 進場貼對帳單再說吧 10/09 00:53\n推 aa6300158   : 況且，現在台灣人很有錢，看演唱會/棒球，好幾千元 10/09 00:53\n→ aa6300158   : 都秒殺不手軟。所以價格一定不是問題，重點是要有 10/09 00:53\n→ aa6300158   : 戰績有明星，有就是1，沒有就是0，現在看不到這樣 10/09 00:53\n→ aa6300158   : 的環境，台服死水，小朋友只喜歡擦玻璃。 10/09 00:53\n推 z789252     : 理想很美好，現實很骨感，投資人是不會長期投資在 10/09 00:54\n→ z789252     : 賺不到錢的個股或是公司，就算一時興起終究還是要 10/09 00:54\n→ z789252     : 面對賠錢虧損的問題 10/09 00:54\n→ LeoYuri     : 不看好 10/09 00:58\n推 st9061204   : 醒，沒明星、沒培養環境、沒內需市場 別買賠錢貨 10/09 00:59\n推 gtaped05550 : 薛丁特 哈哈哈哈哈哈 10/09 00:59\n→ LeoYuri     : 遊戲營運已經沒什麼賺了，也沒有固定拳賽能辦也沒有 10/09 00:59\n→ LeoYuri     : 流量，這公司怎麼賺錢 10/09 00:59\n噓 anal5566    : 進來市場是要賺錢的 把你的情感收好 等著輸到脫褲子 10/09 01:00\n→ anal5566    : 吧 10/09 01:00\n→ LeoYuri     : 越南市場已經很成熟了，要靠什麼搶越南市場？能分到 10/09 01:01\n→ LeoYuri     : 1/10嗎？ 10/09 01:01\n推 dreamdds    : po11找錢很厲害 但 10/09 01:02\n→ LeoYuri     : 找錢厲害那還是找人投資啊...公私盈利能力太差了 10/09 01:04\n噓 kenslc199   : 買到撞到 10/09 01:04\n推 aa6300158   : 最後就是變成迷因股，偶爾會有資金進來讓韭菜上車 10/09 01:05\n→ wald5566    : IPO不是都用來給原始股東套現用的嗎 10/09 01:06\n→ aa6300158   : 先別笑丁特，公司獲利跟籌碼要不要進來是兩回事 10/09 01:07\n→ w28103566   : 公司至少先賺錢 10/09 01:13\n推 omanorboyo  : 丁特成本蠻高的吧 第一天買133張 10/09 01:18\n推 omanorboyo  : 沒意外至少賠150萬 10/09 01:19\n→ omanorboyo  : 等阿航拳上看能不能再炒一下 這支也只能靠炒作了 10/09 01:21\n噓 cool10528   : 憑什麼吃越南市場？ 10/09 01:24\n推 jumpballfan :  拳賽沒梗了 網紅打拳很難看  沒有穩定獲利管道 10/09 01:25\n推 jinx5566    : 對丁特來說小錢，他資產幾十億有吧 10/09 01:28\n推 z789252     : 拳上不是都被爆出來說是一場秀了，而且網紅近年來 10/09 01:31\n→ z789252     : 開始被貼上很多負面標籤，現在很多人看到網紅只會 10/09 01:31\n→ z789252     : 想到社會亂源，導致越來越多人不會去在意那些網紅 10/09 01:31\n→ z789252     : 幹了什麼蠢事，就算看了也會網路上撻伐之後就不會 10/09 01:31\n→ z789252     : 關注了，想靠拳賽增加收入來源是多麼天真的想法 10/09 01:31\n推 HanKWanG1994: PSG幹倒BLG直接買100張 10/09 01:41\n噓 Wolverin5566: 歐印psg 10/09 01:49\n噓 Kai877      : 輸BLG後直接跌20% 不要不信 10/09 01:51\n噓 ken123321987: 每次有JR就要轉去英文台 小公司就有大冗員 不看好 10/09 01:58\n噓 ken123321987: 先把JR開了吧 不知道光他就讓公司少多少廣告收入 10/09 01:59\n推 Arens5566   : 我OK 你先買 10/09 02:00\n推 yh0065      : 大象屌打 10/09 02:12\n推 Shiang1225  : 玩股票的才不CARE立志故事吧 10/09 02:19\n→ faelone     : 這隻10元都沒任何吸引力，真的笑死 10/09 02:36\n→ wizozc495711: 專搞SEA不玩的東西 LOL 10/09 02:56\n推 labihua     : 有夢最美 上市櫃再說 10/09 02:57\n→ labihua     : 憧憬就是輸家的開始 10/09 02:57\n推 ARNOwww     : 好！Psg每進一輪買兩張 冠軍的話能買到8張！ 10/09 03:25\n→ ARNOwww     : 阿不過我看是一張都不用買啦哈哈 10/09 03:26\n推 eric61446   : 戰隊確實跟他沒關 他只是幕後電視傳播方的概念 就是 10/09 03:40\n→ eric61446   : 旁邊主持的 不是主角 10/09 03:40\n→ eric61446   : 特 會支持很正常 人家戰隊前老闆 10/09 03:41\n→ eric61446   : 開始拓到越南六都 日本 應該蠻屌的 10/09 03:42\n→ eric61446   : 開始幫別國辦城市賽 應該不錯 10/09 03:42\n→ eric61446   : 然後一樣找當地網紅 打明星賽 10/09 03:43\n→ eric61446   : 話說馬來西亞怎麼沒有戰隊 10/09 03:43\n→ egg87346    : 興櫃上櫃傻傻分不清楚 10/09 05:15\n推 oldmove     : 我是cs g2迷 台灣沒有cs很可惜 在國外cs比賽獎金多 10/09 05:20\n→ oldmove     : 選手的薪水高 我自己也在cs花不少錢 10/09 05:20\n噓 Murasaki0110: 市場在哪？ 10/09 05:34\n推 Nodens      : 這商業模式沒看到如何創造持續且穩定的金流，沒有訂 10/09 05:57\n→ Nodens      : 閱制只靠辦大型活動真的很困難，看電競的受眾願意掏 10/09 05:57\n→ Nodens      : 錢支持的又有幾個，敢估50價錢也真的很敢開 10/09 05:57\n推 Garysss1    : 薛弘偉的錢 10/09 05:59\n推 tom501062003: 看起來蠻爛的 10/09 06:46\n推 bear2008    : PSG打敗BLG就贊助一張 10/09 06:48\n噓 fastsheep   : 先進八強再說啦 10/09 06:51\n推 YakultSlime : 50真滴貴 10/09 06:56\n噓 s40012      : 以前跟東南亞同賽區也是一樣鳥，想太多了，支持地 10/09 07:31\n→ s40012      : 緣戰隊的意識太強不可能出圈 10/09 07:31\n噓 stockcow666 : 好爛 10/09 07:49\n推 jc761128    : 興櫃50真的搞笑 要賣夢想 還不如賭新藥 10/09 07:59\n噓 good5755    : 有一個有錢的爸媽真好 10/09 08:00\n→ n1234560a   : 國中小生都在打傳說 沒有未來 10/09 08:14\n推 vvv9999     : 先等他嘴角壓得下來再說 10/09 08:15\n推 x58420      : 不如買博弈股 10/09 08:16\n→ nailo71     : 就這三項我覺得很有難度… 10/09 08:19\n推 godofevil   : 你這是股東還沒出清完股票在抬股價嗎 10/09 08:20\n推 vmcjormp    : 如果興櫃改規則可以放空 10/09 08:23\n噓 allen1995j  : 別害人 10/09 08:27\n推 cetus       : 買這個真的是有愛，一堆好公司能買 10/09 08:30\n→ st800800800 : 所以丁特很會投資？每次看到他談投資下面一堆粉絲狂 10/09 08:31\n→ st800800800 : 吹 10/09 08:31\n→ longkiss0618: 買個幾張支持po11 10/09 08:35\n推 likeconan02 : 同樣是彩券 買這只不如買生技 10/09 08:41\n推 monkeyaaaaa : 等LOL明星選手退役沒新人頂上靠網紅打拳能賺多久? 10/09 08:48\n推 joeboy      : 我是建議等psg回國再買 10/09 08:50\n推 moneychen   : Faker退役就爆炸 10/09 08:54\n推 tonylolz    : 股板壞人多 10/09 08:56\n噓 winston06   : 進八強我歐印啦 10/09 08:58\n噓 cactusicecre: 墮胎仔 空到你下市 電競這種慘業也敢發 害死人 10/09 09:02\n→ bsKershaw828: 壞人 10/09 09:09\n推 chengyu1010 : 我也不知道要靠什麼賺錢欸 10/09 09:10\n噓 jim830724   : 你把cs放在哪？ 10/09 09:21\n→ Cjwinds     : LOL流量高沒用 看看世界賽獎金就知道拳頭有多窮酸 10/09 09:21\n推 tocks2010   : 支持蹦版 蹦蛙老闆 10/09 09:23\n推 st950127st  : PSG幹贏BLG一定買來支持 10/09 09:25\n推 gtaped05550 : 丁特那些特粉都那些族群啊，根本搞笑的 10/09 09:31\n推 chou3321    : 1.LOL觀眾一堆老人 吸引不到年輕人 2.沒有像樣的網 10/09 09:33\n→ chou3321    : 紅 3.有紅牛和魔爪 誰他媽要喝鍇睿能量飲= = 10/09 09:33\n噓 VVVV5555    : 業味好濃 不虧是行銷業 10/09 09:58\n推 DuskStan    : 老哥 快到40了 準備進場喔 10/09 10:08\n→ blackboard  : 電競要賣周邊 網紅直播 甚至培養啦啦隊 10/09 10:45\n→ blackboard  : 中職就是靠 啦啦隊翻紅的 提高進場率 10/09 10:46\n→ blackboard  : 台正規打拳可能沒人要看 可是網紅打拳看熱鬧的不少 10/09 10:49\n→ blackboard  : 這次票不就賣完了 然後可以引進 UFC 職業拳賽 10/09 10:51\n→ blackboard  : 台灣人最愛湊熱鬧 台灣市場消費力 不會讓們失望的 10/09 10:53\n推 Cactusman   : 笑死人 有講跟沒講一樣 10/09 10:54\n推 gold33      : 怎麼打都這幾個選手 根本沒有新人要玩 不看好 10/09 11:09\n噓 energyy1104 : 上半年虧3800萬怎麼不講 10/09 11:18\n→ Casper50    : 老闆一直偷笑 10/09 11:19\n推 hspsp60808  : 不太像寬宏比較像展逸 10/09 11:25\n推 JiangDong   : 不如隨便找幾隻新藥股蹲都強多，反正都是賭博 10/09 11:30\n推 mnxzq       : 薛丁特的錢 10/09 11:36\n推 hsueh00     : 看你前面先說電子競技14年沒倒 佐證的理由卻一大部 10/09 12:14\n→ hsueh00     : 分是講LoL 你知我知LoL現在就是末期垂死掙扎的狀態 10/09 12:14\n→ hsueh00     : 若真的要轉電子競技、拳賽 愛爾達會輸？？ 為什麼愛 10/09 12:14\n→ hsueh00     : 爾達不播？有沒有想過 10/09 12:14\n推 mike03486   : 先等獎勵局BLg過吧 10/09 12:20\n推 a4715646    : 行銷業 10/09 13:10\n→ BruceChen227: 偷笑喔po11 10/09 14:15\n噓 UncleIrving : 買這隻虧爛的東西幹嘛 10/09 15:00\n→ chenpfu0394 : lol這遊戲都10幾年了 不出新的只會走下坡 拳擊也是 10/09 19:18\n→ chenpfu0394 : 找網紅打娛樂性久了就膩了專業的沒人要看 不過你開 10/09 19:18\n→ chenpfu0394 : 心就好 10/09 19:18\n",
        "TIME": "Wed Oct  9 00:02:45 2024",
        "MESSAGE_ALL": 195,
        "BOO": 21,
        "PUSH": 81,
        "MESSAGE_COUNT": 60,
        "NEUTRAL": 93,
        "TAG": "標的"
    }
}